{
  "line": 1,
  "column": 18,
  "kind": "Program",
  "elems": [
    {
      "line": 1,
      "column": 18,
      "kind": "Return",
      "value": null,
      "elems": [
        {
          "line": 1,
          "column": 17,
          "kind": "BinOp",
          "elems": [
            {
              "line": 1,
              "column": 13,
              "kind": "BinOp",
              "elems": [
                {
                  "line": 1,
                  "column": 8,
                  "kind": "IntLiteral",
                  "value": 10,
                  "elems": []
                },
                {
                  "line": 1,
                  "column": 13,
                  "kind": "IntLiteral",
                  "value": 5,
                  "elems": []
                }
              ],
              "value": "-"
            },
            {
              "line": 1,
              "column": 17,
              "kind": "IntLiteral",
              "value": 2,
              "elems": []
            }
          ],
          "value": "-"
        }
      ]
    }
  ],
  "value": null
}
