{
  "line": 7,
  "column": 1,
  "kind": "Program",
  "elems": [
    {
      "line": 3,
      "column": 1,
      "kind": "FuncDecl",
      "elems": [
        {
          "line": 3,
          "column": 1,
          "kind": "Block",
          "elems": [
            {
              "line": 2,
              "column": 14,
              "kind": "Return",
              "value": null,
              "elems": [
                {
                  "line": 2,
                  "column": 12,
                  "kind": "IntLiteral",
                  "value": 42,
                  "elems": []
                }
              ]
            }
          ],
          "value": null
        }
      ],
      "value": "foo"
    },
    {
      "line": 7,
      "column": 1,
      "kind": "FuncDecl",
      "elems": [
        {
          "line": 7,
          "column": 1,
          "kind": "Block",
          "elems": [
            {
              "line": 6,
              "column": 13,
              "kind": "Return",
              "value": null,
              "elems": [
                {
                  "line": 6,
                  "column": 12,
                  "kind": "IntLiteral",
                  "value": 0,
                  "elems": []
                }
              ]
            }
          ],
          "value": null
        }
      ],
      "value": "main"
    }
  ],
  "value": null
}
