{
  "line": 12,
  "column": 1,
  "kind": "Program",
  "elems": [
    {
      "line": 4,
      "column": 1,
      "kind": "StructDecl",
      "elems": [
        {
          "line": 2,
          "column": 13,
          "kind": "Declare",
          "mut": "val",
          "type": "Int64",
          "elems": [],
          "value": "x"
        },
        {
          "line": 3,
          "column": 13,
          "kind": "Declare",
          "mut": "val",
          "type": "Int64",
          "elems": [],
          "value": "y"
        }
      ],
      "value": "Point"
    },
    {
      "line": 12,
      "column": 1,
      "kind": "FuncDecl",
      "returnType": "Int64",
      "elems": [
        {
          "line": 12,
          "column": 1,
          "kind": "Block",
          "elems": [
            {
              "line": 7,
              "column": 17,
              "kind": "Declare",
              "mut": "var",
              "type": "Point",
              "elems": [],
              "value": "p"
            },
            {
              "line": 8,
              "column": 13,
              "kind": "Assign",
              "value": null,
              "elems": [
                {
                  "line": 8,
                  "column": 7,
                  "kind": "FieldAccess",
                  "elems": [
                    {
                      "line": 8,
                      "column": 5,
                      "kind": "Ident",
                      "elems": [],
                      "value": "p"
                    }
                  ],
                  "value": "x"
                },
                {
                  "line": 8,
                  "column": 11,
                  "kind": "IntLiteral",
                  "value": 10,
                  "elems": []
                }
              ]
            },
            {
              "line": 9,
              "column": 13,
              "kind": "Assign",
              "value": null,
              "elems": [
                {
                  "line": 9,
                  "column": 7,
                  "kind": "FieldAccess",
                  "elems": [
                    {
                      "line": 9,
                      "column": 5,
                      "kind": "Ident",
                      "elems": [],
                      "value": "p"
                    }
                  ],
                  "value": "y"
                },
                {
                  "line": 9,
                  "column": 11,
                  "kind": "IntLiteral",
                  "value": 20,
                  "elems": []
                }
              ]
            },
            {
              "line": 10,
              "column": 31,
              "kind": "Declare",
              "mut": "val",
              "type": "Int64",
              "elems": [
                {
                  "line": 10,
                  "column": 30,
                  "kind": "BinOp",
                  "elems": [
                    {
                      "line": 10,
                      "column": 24,
                      "kind": "FieldAccess",
                      "elems": [
                        {
                          "line": 10,
                          "column": 22,
                          "kind": "Ident",
                          "elems": [],
                          "value": "p"
                        }
                      ],
                      "value": "x"
                    },
                    {
                      "line": 10,
                      "column": 30,
                      "kind": "FieldAccess",
                      "elems": [
                        {
                          "line": 10,
                          "column": 28,
                          "kind": "Ident",
                          "elems": [],
                          "value": "p"
                        }
                      ],
                      "value": "y"
                    }
                  ],
                  "value": "+"
                }
              ],
              "value": "sum"
            },
            {
              "line": 11,
              "column": 15,
              "kind": "Return",
              "value": null,
              "elems": [
                {
                  "line": 11,
                  "column": 12,
                  "kind": "Ident",
                  "elems": [],
                  "value": "sum"
                }
              ]
            }
          ],
          "value": null
        }
      ],
      "value": "main"
    }
  ],
  "value": null
}
