{
  "line": 3,
  "column": 14,
  "kind": "Program",
  "elems": [
    {
      "line": 1,
      "column": 10,
      "kind": "Declare",
      "mut": "var",
      "elems": [
        {
          "line": 1,
          "column": 9,
          "kind": "IntLiteral",
          "value": 1,
          "elems": []
        }
      ],
      "value": "x"
    },
    {
      "line": 3,
      "column": 14,
      "kind": "While",
      "elems": [
        {
          "line": 2,
          "column": 8,
          "kind": "Ident",
          "elems": [],
          "value": "x"
        },
        {
          "line": 3,
          "column": 14,
          "kind": "Assign",
          "value": null,
          "elems": [
            {
              "line": 3,
              "column": 5,
              "kind": "Ident",
              "elems": [],
              "value": "x"
            },
            {
              "line": 3,
              "column": 13,
              "kind": "BinOp",
              "elems": [
                {
                  "line": 3,
                  "column": 9,
                  "kind": "Ident",
                  "elems": [],
                  "value": "x"
                },
                {
                  "line": 3,
                  "column": 13,
                  "kind": "IntLiteral",
                  "value": 1,
                  "elems": []
                }
              ],
              "value": "-"
            }
          ]
        }
      ],
      "value": null
    }
  ],
  "value": null
}
