{
  "line": 2,
  "column": 9,
  "kind": "Program",
  "elems": [
    {
      "line": 1,
      "column": 6,
      "kind": "Break",
      "elems": [],
      "value": null
    },
    {
      "line": 2,
      "column": 9,
      "kind": "Return",
      "value": null,
      "elems": [
        {
          "line": 2,
          "column": 8,
          "kind": "IntLiteral",
          "value": 0,
          "elems": []
        }
      ]
    }
  ],
  "value": null
}
