{
  "line": 6,
  "column": 1,
  "kind": "Program",
  "elems": [
    {
      "line": 1,
      "column": 18,
      "kind": "ExternDecl",
      "elems": [
        {
          "line": 1,
          "column": 16,
          "kind": "Ident",
          "elems": [],
          "value": "x"
        }
      ],
      "value": "foo"
    },
    {
      "line": 2,
      "column": 21,
      "kind": "ExternDecl",
      "elems": [
        {
          "line": 2,
          "column": 16,
          "kind": "Ident",
          "elems": [],
          "value": "y"
        },
        {
          "line": 2,
          "column": 19,
          "kind": "Ident",
          "elems": [],
          "value": "z"
        }
      ],
      "value": "bar"
    },
    {
      "line": 6,
      "column": 1,
      "kind": "FuncDecl",
      "elems": [
        {
          "line": 6,
          "column": 1,
          "kind": "Block",
          "elems": [
            {
              "line": 5,
              "column": 13,
              "kind": "Return",
              "value": null,
              "elems": [
                {
                  "line": 5,
                  "column": 12,
                  "kind": "IntLiteral",
                  "value": 0,
                  "elems": []
                }
              ]
            }
          ],
          "value": null
        }
      ],
      "value": "main"
    }
  ],
  "value": null
}
