{
  "line": 2,
  "column": 9,
  "kind": "Program",
  "elems": [
    {
      "line": 1,
      "column": 7,
      "kind": "Assign",
      "value": null,
      "elems": [
        {
          "line": 1,
          "column": 1,
          "kind": "Ident",
          "elems": [],
          "value": "x"
        },
        {
          "line": 1,
          "column": 5,
          "kind": "IntLiteral",
          "value": 42,
          "elems": []
        }
      ]
    },
    {
      "line": 2,
      "column": 9,
      "kind": "Return",
      "value": null,
      "elems": [
        {
          "line": 2,
          "column": 8,
          "kind": "Ident",
          "elems": [],
          "value": "x"
        }
      ]
    }
  ],
  "value": null
}
