{
  "line": 12,
  "column": 1,
  "kind": "Program",
  "elems": [
    {
      "line": 1,
      "column": 10,
      "kind": "Declare",
      "mut": "var",
      "elems": [
        {
          "line": 1,
          "column": 9,
          "kind": "IntLiteral",
          "value": 1,
          "elems": []
        }
      ],
      "value": "x"
    },
    {
      "line": 2,
      "column": 10,
      "kind": "Declare",
      "mut": "var",
      "elems": [
        {
          "line": 2,
          "column": 9,
          "kind": "IntLiteral",
          "value": 0,
          "elems": []
        }
      ],
      "value": "y"
    },
    {
      "line": 3,
      "column": 10,
      "kind": "Declare",
      "mut": "var",
      "elems": [
        {
          "line": 3,
          "column": 9,
          "kind": "IntLiteral",
          "value": 0,
          "elems": []
        }
      ],
      "value": "z"
    },
    {
      "line": 12,
      "column": 1,
      "kind": "If",
      "elems": [
        {
          "line": 4,
          "column": 5,
          "kind": "Ident",
          "elems": [],
          "value": "x"
        },
        {
          "line": 10,
          "column": 1,
          "kind": "Block",
          "elems": [
            {
              "line": 9,
              "column": 5,
              "kind": "If",
              "elems": [
                {
                  "line": 5,
                  "column": 9,
                  "kind": "Ident",
                  "elems": [],
                  "value": "y"
                },
                {
                  "line": 7,
                  "column": 5,
                  "kind": "Block",
                  "elems": [
                    {
                      "line": 6,
                      "column": 14,
                      "kind": "Assign",
                      "value": null,
                      "elems": [
                        {
                          "line": 6,
                          "column": 9,
                          "kind": "Ident",
                          "elems": [],
                          "value": "z"
                        },
                        {
                          "line": 6,
                          "column": 13,
                          "kind": "IntLiteral",
                          "value": 1,
                          "elems": []
                        }
                      ]
                    }
                  ],
                  "value": null
                },
                {
                  "line": 9,
                  "column": 5,
                  "kind": "Block",
                  "elems": [
                    {
                      "line": 8,
                      "column": 14,
                      "kind": "Assign",
                      "value": null,
                      "elems": [
                        {
                          "line": 8,
                          "column": 9,
                          "kind": "Ident",
                          "elems": [],
                          "value": "z"
                        },
                        {
                          "line": 8,
                          "column": 13,
                          "kind": "IntLiteral",
                          "value": 2,
                          "elems": []
                        }
                      ]
                    }
                  ],
                  "value": null
                }
              ],
              "value": null
            }
          ],
          "value": null
        },
        {
          "line": 12,
          "column": 1,
          "kind": "Block",
          "elems": [
            {
              "line": 11,
              "column": 10,
              "kind": "Assign",
              "value": null,
              "elems": [
                {
                  "line": 11,
                  "column": 5,
                  "kind": "Ident",
                  "elems": [],
                  "value": "z"
                },
                {
                  "line": 11,
                  "column": 9,
                  "kind": "IntLiteral",
                  "value": 3,
                  "elems": []
                }
              ]
            }
          ],
          "value": null
        }
      ],
      "value": null
    }
  ],
  "value": null
}
