{
  "line": 7,
  "column": 1,
  "kind": "Program",
  "elems": [
    {
      "line": 3,
      "column": 1,
      "kind": "FuncDecl",
      "elems": [
        {
          "line": 3,
          "column": 1,
          "kind": "Block",
          "elems": [
            {
              "line": 2,
              "column": 19,
              "kind": "Return",
              "value": null,
              "elems": [
                {
                  "line": 2,
                  "column": 18,
                  "kind": "Call",
                  "elems": [
                    {
                      "line": 2,
                      "column": 12,
                      "kind": "Ident",
                      "elems": [],
                      "value": "foo"
                    },
                    {
                      "line": 2,
                      "column": 16,
                      "kind": "IntLiteral",
                      "value": 42,
                      "elems": []
                    }
                  ],
                  "value": null
                }
              ]
            }
          ],
          "value": null
        }
      ],
      "value": "main"
    },
    {
      "line": 7,
      "column": 1,
      "kind": "FuncDecl",
      "elems": [
        {
          "line": 5,
          "column": 9,
          "kind": "Ident",
          "elems": [],
          "value": "x"
        },
        {
          "line": 7,
          "column": 1,
          "kind": "Block",
          "elems": [
            {
              "line": 6,
              "column": 13,
              "kind": "Return",
              "value": null,
              "elems": [
                {
                  "line": 6,
                  "column": 12,
                  "kind": "Ident",
                  "elems": [],
                  "value": "x"
                }
              ]
            }
          ],
          "value": null
        }
      ],
      "value": "foo"
    }
  ],
  "value": null
}
