{
  "line": 7,
  "column": 1,
  "kind": "Program",
  "elems": [
    {
      "line": 1,
      "column": 10,
      "kind": "Declare",
      "mut": "var",
      "elems": [
        {
          "line": 1,
          "column": 9,
          "kind": "IntLiteral",
          "value": 1,
          "elems": []
        }
      ],
      "value": "x"
    },
    {
      "line": 2,
      "column": 10,
      "kind": "Declare",
      "mut": "var",
      "elems": [
        {
          "line": 2,
          "column": 9,
          "kind": "IntLiteral",
          "value": 0,
          "elems": []
        }
      ],
      "value": "y"
    },
    {
      "line": 7,
      "column": 1,
      "kind": "If",
      "elems": [
        {
          "line": 3,
          "column": 20,
          "kind": "BinOp",
          "elems": [
            {
              "line": 3,
              "column": 10,
              "kind": "BinOp",
              "elems": [
                {
                  "line": 3,
                  "column": 5,
                  "kind": "Ident",
                  "elems": [],
                  "value": "x"
                },
                {
                  "line": 3,
                  "column": 10,
                  "kind": "IntLiteral",
                  "value": 0,
                  "elems": []
                }
              ],
              "value": "!="
            },
            {
              "line": 3,
              "column": 20,
              "kind": "BinOp",
              "elems": [
                {
                  "line": 3,
                  "column": 15,
                  "kind": "Ident",
                  "elems": [],
                  "value": "y"
                },
                {
                  "line": 3,
                  "column": 20,
                  "kind": "IntLiteral",
                  "value": 0,
                  "elems": []
                }
              ],
              "value": "!="
            }
          ],
          "value": "&&"
        },
        {
          "line": 5,
          "column": 1,
          "kind": "Block",
          "elems": [
            {
              "line": 4,
              "column": 11,
              "kind": "Return",
              "value": null,
              "elems": [
                {
                  "line": 4,
                  "column": 10,
                  "kind": "IntLiteral",
                  "value": 1,
                  "elems": []
                }
              ]
            }
          ],
          "value": null
        },
        {
          "line": 7,
          "column": 1,
          "kind": "Block",
          "elems": [
            {
              "line": 6,
              "column": 11,
              "kind": "Return",
              "value": null,
              "elems": [
                {
                  "line": 6,
                  "column": 10,
                  "kind": "IntLiteral",
                  "value": 0,
                  "elems": []
                }
              ]
            }
          ],
          "value": null
        }
      ],
      "value": null
    }
  ],
  "value": null
}
