{
  "line": 10,
  "column": 1,
  "kind": "Program",
  "elems": [
    {
      "line": 6,
      "column": 1,
      "kind": "FuncDecl",
      "elems": [
        {
          "line": 1,
          "column": 10,
          "kind": "Ident",
          "elems": [],
          "value": "n"
        },
        {
          "line": 6,
          "column": 1,
          "kind": "Block",
          "elems": [
            {
              "line": 4,
              "column": 5,
              "kind": "If",
              "elems": [
                {
                  "line": 2,
                  "column": 14,
                  "kind": "BinOp",
                  "elems": [
                    {
                      "line": 2,
                      "column": 9,
                      "kind": "Ident",
                      "elems": [],
                      "value": "n"
                    },
                    {
                      "line": 2,
                      "column": 14,
                      "kind": "IntLiteral",
                      "value": 1,
                      "elems": []
                    }
                  ],
                  "value": "<="
                },
                {
                  "line": 4,
                  "column": 5,
                  "kind": "Block",
                  "elems": [
                    {
                      "line": 3,
                      "column": 17,
                      "kind": "Return",
                      "value": null,
                      "elems": [
                        {
                          "line": 3,
                          "column": 16,
                          "kind": "IntLiteral",
                          "value": 1,
                          "elems": []
                        }
                      ]
                    }
                  ],
                  "value": null
                }
              ],
              "value": null
            },
            {
              "line": 5,
              "column": 27,
              "kind": "Return",
              "value": null,
              "elems": [
                {
                  "line": 5,
                  "column": 26,
                  "kind": "BinOp",
                  "elems": [
                    {
                      "line": 5,
                      "column": 12,
                      "kind": "Ident",
                      "elems": [],
                      "value": "n"
                    },
                    {
                      "line": 5,
                      "column": 26,
                      "kind": "Call",
                      "elems": [
                        {
                          "line": 5,
                          "column": 16,
                          "kind": "Ident",
                          "elems": [],
                          "value": "fact"
                        },
                        {
                          "line": 5,
                          "column": 25,
                          "kind": "BinOp",
                          "elems": [
                            {
                              "line": 5,
                              "column": 21,
                              "kind": "Ident",
                              "elems": [],
                              "value": "n"
                            },
                            {
                              "line": 5,
                              "column": 25,
                              "kind": "IntLiteral",
                              "value": 1,
                              "elems": []
                            }
                          ],
                          "value": "-"
                        }
                      ],
                      "value": null
                    }
                  ],
                  "value": "*"
                }
              ]
            }
          ],
          "value": null
        }
      ],
      "value": "fact"
    },
    {
      "line": 10,
      "column": 1,
      "kind": "FuncDecl",
      "elems": [
        {
          "line": 10,
          "column": 1,
          "kind": "Block",
          "elems": [
            {
              "line": 9,
              "column": 13,
              "kind": "Return",
              "value": null,
              "elems": [
                {
                  "line": 9,
                  "column": 12,
                  "kind": "IntLiteral",
                  "value": 0,
                  "elems": []
                }
              ]
            }
          ],
          "value": null
        }
      ],
      "value": "main"
    }
  ],
  "value": null
}
