{
  "line": 4,
  "column": 2,
  "kind": "Program",
  "elems": [
    {
      "line": 4,
      "column": 2,
      "kind": "ExprStmt",
      "value": null,
      "elems": [
        {
          "line": 4,
          "column": 2,
          "kind": "BinOp",
          "elems": [
            {
              "line": 1,
              "column": 1,
              "kind": "IntLiteral",
              "value": 123,
              "elems": []
            },
            {
              "line": 4,
              "column": 2,
              "kind": "BinOp",
              "elems": [
                {
                  "line": 3,
                  "column": 1,
                  "kind": "IntLiteral",
                  "value": 42,
                  "elems": []
                },
                {
                  "line": 4,
                  "column": 2,
                  "kind": "Ident",
                  "elems": [],
                  "value": "abc"
                }
              ],
              "value": "*"
            }
          ],
          "value": "+"
        }
      ]
    }
  ],
  "value": null
}
