{
  "line": 6,
  "column": 20,
  "kind": "Program",
  "elems": [
    {
      "line": 1,
      "column": 17,
      "kind": "Declare",
      "mut": "var",
      "elems": [
        {
          "line": 1,
          "column": 16,
          "kind": "BinOp",
          "elems": [
            {
              "line": 1,
              "column": 11,
              "kind": "IntLiteral",
              "value": 1,
              "elems": []
            },
            {
              "line": 1,
              "column": 16,
              "kind": "IntLiteral",
              "value": 2,
              "elems": []
            }
          ],
          "value": "=="
        }
      ],
      "value": "cmp"
    },
    {
      "line": 2,
      "column": 18,
      "kind": "Declare",
      "mut": "var",
      "elems": [
        {
          "line": 2,
          "column": 17,
          "kind": "BinOp",
          "elems": [
            {
              "line": 2,
              "column": 12,
              "kind": "IntLiteral",
              "value": 3,
              "elems": []
            },
            {
              "line": 2,
              "column": 17,
              "kind": "IntLiteral",
              "value": 4,
              "elems": []
            }
          ],
          "value": "!="
        }
      ],
      "value": "cmp2"
    },
    {
      "line": 3,
      "column": 17,
      "kind": "Declare",
      "mut": "var",
      "elems": [
        {
          "line": 3,
          "column": 16,
          "kind": "BinOp",
          "elems": [
            {
              "line": 3,
              "column": 12,
              "kind": "IntLiteral",
              "value": 5,
              "elems": []
            },
            {
              "line": 3,
              "column": 16,
              "kind": "IntLiteral",
              "value": 6,
              "elems": []
            }
          ],
          "value": "<"
        }
      ],
      "value": "cmp3"
    },
    {
      "line": 4,
      "column": 17,
      "kind": "Declare",
      "mut": "var",
      "elems": [
        {
          "line": 4,
          "column": 16,
          "kind": "BinOp",
          "elems": [
            {
              "line": 4,
              "column": 12,
              "kind": "IntLiteral",
              "value": 7,
              "elems": []
            },
            {
              "line": 4,
              "column": 16,
              "kind": "IntLiteral",
              "value": 8,
              "elems": []
            }
          ],
          "value": ">"
        }
      ],
      "value": "cmp4"
    },
    {
      "line": 5,
      "column": 19,
      "kind": "Declare",
      "mut": "var",
      "elems": [
        {
          "line": 5,
          "column": 17,
          "kind": "BinOp",
          "elems": [
            {
              "line": 5,
              "column": 12,
              "kind": "IntLiteral",
              "value": 9,
              "elems": []
            },
            {
              "line": 5,
              "column": 17,
              "kind": "IntLiteral",
              "value": 10,
              "elems": []
            }
          ],
          "value": "<="
        }
      ],
      "value": "cmp5"
    },
    {
      "line": 6,
      "column": 20,
      "kind": "Declare",
      "mut": "var",
      "elems": [
        {
          "line": 6,
          "column": 18,
          "kind": "BinOp",
          "elems": [
            {
              "line": 6,
              "column": 12,
              "kind": "IntLiteral",
              "value": 11,
              "elems": []
            },
            {
              "line": 6,
              "column": 18,
              "kind": "IntLiteral",
              "value": 12,
              "elems": []
            }
          ],
          "value": ">="
        }
      ],
      "value": "cmp6"
    }
  ],
  "value": null
}
