{
  "line": 8,
  "column": 1,
  "kind": "Program",
  "elems": [
    {
      "line": 8,
      "column": 1,
      "kind": "FuncDecl",
      "returnType": "Int64",
      "elems": [
        {
          "line": 8,
          "column": 1,
          "kind": "Block",
          "elems": [
            {
              "line": 2,
              "column": 23,
              "kind": "Declare",
              "mut": "var",
              "type": "Array[10](Int64)",
              "elems": [],
              "value": "arr"
            },
            {
              "line": 3,
              "column": 15,
              "kind": "Assign",
              "value": null,
              "elems": [
                {
                  "line": 3,
                  "column": 10,
                  "kind": "Subscript",
                  "elems": [
                    {
                      "line": 3,
                      "column": 5,
                      "kind": "Ident",
                      "elems": [],
                      "value": "arr"
                    },
                    {
                      "line": 3,
                      "column": 9,
                      "kind": "IntLiteral",
                      "value": 0,
                      "elems": []
                    }
                  ],
                  "value": null
                },
                {
                  "line": 3,
                  "column": 14,
                  "kind": "IntLiteral",
                  "value": 1,
                  "elems": []
                }
              ]
            },
            {
              "line": 4,
              "column": 15,
              "kind": "Assign",
              "value": null,
              "elems": [
                {
                  "line": 4,
                  "column": 10,
                  "kind": "Subscript",
                  "elems": [
                    {
                      "line": 4,
                      "column": 5,
                      "kind": "Ident",
                      "elems": [],
                      "value": "arr"
                    },
                    {
                      "line": 4,
                      "column": 9,
                      "kind": "IntLiteral",
                      "value": 1,
                      "elems": []
                    }
                  ],
                  "value": null
                },
                {
                  "line": 4,
                  "column": 14,
                  "kind": "IntLiteral",
                  "value": 2,
                  "elems": []
                }
              ]
            },
            {
              "line": 5,
              "column": 15,
              "kind": "Assign",
              "value": null,
              "elems": [
                {
                  "line": 5,
                  "column": 10,
                  "kind": "Subscript",
                  "elems": [
                    {
                      "line": 5,
                      "column": 5,
                      "kind": "Ident",
                      "elems": [],
                      "value": "arr"
                    },
                    {
                      "line": 5,
                      "column": 9,
                      "kind": "IntLiteral",
                      "value": 2,
                      "elems": []
                    }
                  ],
                  "value": null
                },
                {
                  "line": 5,
                  "column": 14,
                  "kind": "IntLiteral",
                  "value": 3,
                  "elems": []
                }
              ]
            },
            {
              "line": 6,
              "column": 46,
              "kind": "Declare",
              "mut": "val",
              "type": "Int64",
              "elems": [
                {
                  "line": 6,
                  "column": 45,
                  "kind": "BinOp",
                  "elems": [
                    {
                      "line": 6,
                      "column": 36,
                      "kind": "BinOp",
                      "elems": [
                        {
                          "line": 6,
                          "column": 27,
                          "kind": "Subscript",
                          "elems": [
                            {
                              "line": 6,
                              "column": 22,
                              "kind": "Ident",
                              "elems": [],
                              "value": "arr"
                            },
                            {
                              "line": 6,
                              "column": 26,
                              "kind": "IntLiteral",
                              "value": 0,
                              "elems": []
                            }
                          ],
                          "value": null
                        },
                        {
                          "line": 6,
                          "column": 36,
                          "kind": "Subscript",
                          "elems": [
                            {
                              "line": 6,
                              "column": 31,
                              "kind": "Ident",
                              "elems": [],
                              "value": "arr"
                            },
                            {
                              "line": 6,
                              "column": 35,
                              "kind": "IntLiteral",
                              "value": 1,
                              "elems": []
                            }
                          ],
                          "value": null
                        }
                      ],
                      "value": "+"
                    },
                    {
                      "line": 6,
                      "column": 45,
                      "kind": "Subscript",
                      "elems": [
                        {
                          "line": 6,
                          "column": 40,
                          "kind": "Ident",
                          "elems": [],
                          "value": "arr"
                        },
                        {
                          "line": 6,
                          "column": 44,
                          "kind": "IntLiteral",
                          "value": 2,
                          "elems": []
                        }
                      ],
                      "value": null
                    }
                  ],
                  "value": "+"
                }
              ],
              "value": "sum"
            },
            {
              "line": 7,
              "column": 15,
              "kind": "Return",
              "value": null,
              "elems": [
                {
                  "line": 7,
                  "column": 12,
                  "kind": "Ident",
                  "elems": [],
                  "value": "sum"
                }
              ]
            }
          ],
          "value": null
        }
      ],
      "value": "main"
    }
  ],
  "value": null
}
