{
  "line": 18,
  "column": 1,
  "kind": "Program",
  "elems": [
    {
      "line": 4,
      "column": 1,
      "kind": "StructDecl",
      "elems": [
        {
          "line": 2,
          "column": 13,
          "kind": "Declare",
          "mut": "val",
          "type": "Int64",
          "elems": [],
          "value": "x"
        },
        {
          "line": 3,
          "column": 13,
          "kind": "Declare",
          "mut": "val",
          "type": "Int64",
          "elems": [],
          "value": "y"
        }
      ],
      "value": "Point"
    },
    {
      "line": 11,
      "column": 1,
      "kind": "FuncDecl",
      "returnType": "Point",
      "elems": [
        {
          "line": 6,
          "column": 19,
          "kind": "Param",
          "type": "Int64",
          "elems": [],
          "value": "px"
        },
        {
          "line": 6,
          "column": 30,
          "kind": "Param",
          "type": "Int64",
          "elems": [],
          "value": "py"
        },
        {
          "line": 11,
          "column": 1,
          "kind": "Block",
          "elems": [
            {
              "line": 7,
              "column": 17,
              "kind": "Declare",
              "mut": "var",
              "type": "Point",
              "elems": [],
              "value": "p"
            },
            {
              "line": 8,
              "column": 13,
              "kind": "Assign",
              "value": null,
              "elems": [
                {
                  "line": 8,
                  "column": 7,
                  "kind": "FieldAccess",
                  "elems": [
                    {
                      "line": 8,
                      "column": 5,
                      "kind": "Ident",
                      "elems": [],
                      "value": "p"
                    }
                  ],
                  "value": "x"
                },
                {
                  "line": 8,
                  "column": 11,
                  "kind": "Ident",
                  "elems": [],
                  "value": "px"
                }
              ]
            },
            {
              "line": 9,
              "column": 13,
              "kind": "Assign",
              "value": null,
              "elems": [
                {
                  "line": 9,
                  "column": 7,
                  "kind": "FieldAccess",
                  "elems": [
                    {
                      "line": 9,
                      "column": 5,
                      "kind": "Ident",
                      "elems": [],
                      "value": "p"
                    }
                  ],
                  "value": "y"
                },
                {
                  "line": 9,
                  "column": 11,
                  "kind": "Ident",
                  "elems": [],
                  "value": "py"
                }
              ]
            },
            {
              "line": 10,
              "column": 13,
              "kind": "Return",
              "value": null,
              "elems": [
                {
                  "line": 10,
                  "column": 12,
                  "kind": "Ident",
                  "elems": [],
                  "value": "p"
                }
              ]
            }
          ],
          "value": null
        }
      ],
      "value": "makePoint"
    },
    {
      "line": 18,
      "column": 1,
      "kind": "FuncDecl",
      "returnType": "Int64",
      "elems": [
        {
          "line": 18,
          "column": 1,
          "kind": "Block",
          "elems": [
            {
              "line": 14,
              "column": 18,
              "kind": "Declare",
              "mut": "var",
              "type": "Point",
              "elems": [],
              "value": "pt"
            },
            {
              "line": 15,
              "column": 25,
              "kind": "Assign",
              "value": null,
              "elems": [
                {
                  "line": 15,
                  "column": 5,
                  "kind": "Ident",
                  "elems": [],
                  "value": "pt"
                },
                {
                  "line": 15,
                  "column": 24,
                  "kind": "Call",
                  "elems": [
                    {
                      "line": 15,
                      "column": 10,
                      "kind": "Ident",
                      "elems": [],
                      "value": "makePoint"
                    },
                    {
                      "line": 15,
                      "column": 20,
                      "kind": "IntLiteral",
                      "value": 3,
                      "elems": []
                    },
                    {
                      "line": 15,
                      "column": 23,
                      "kind": "IntLiteral",
                      "value": 4,
                      "elems": []
                    }
                  ],
                  "value": null
                }
              ]
            },
            {
              "line": 16,
              "column": 36,
              "kind": "Declare",
              "mut": "val",
              "type": "Int64",
              "elems": [
                {
                  "line": 16,
                  "column": 35,
                  "kind": "BinOp",
                  "elems": [
                    {
                      "line": 16,
                      "column": 28,
                      "kind": "FieldAccess",
                      "elems": [
                        {
                          "line": 16,
                          "column": 25,
                          "kind": "Ident",
                          "elems": [],
                          "value": "pt"
                        }
                      ],
                      "value": "x"
                    },
                    {
                      "line": 16,
                      "column": 35,
                      "kind": "FieldAccess",
                      "elems": [
                        {
                          "line": 16,
                          "column": 32,
                          "kind": "Ident",
                          "elems": [],
                          "value": "pt"
                        }
                      ],
                      "value": "y"
                    }
                  ],
                  "value": "+"
                }
              ],
              "value": "result"
            },
            {
              "line": 17,
              "column": 18,
              "kind": "Return",
              "value": null,
              "elems": [
                {
                  "line": 17,
                  "column": 12,
                  "kind": "Ident",
                  "elems": [],
                  "value": "result"
                }
              ]
            }
          ],
          "value": null
        }
      ],
      "value": "main"
    }
  ],
  "value": null
}
